,en,fr
233,"Astronomers « Return to the observatories The Dominion Astrophysical Observatory The first Canadian observatory of international calibre, it once housed the largest telescope in the world The Dominion Astrophysical Observatory was inaugurated in 1918 at Saanich near Victoria, British Columbia.","Astronomes « Retour aux observatoires L'Observatoire Fédéral d'Astrophysique Premier observatoire canadien d'envergure internationale, il abrita pendant un moment le plus grand télescope au monde L'Observatoire Fédéral d'Astrophysique est inauguré en 1918 à Saanich, près de Victoria, en Colombie-Britanique."
234,Its creation was motivated by the growing need of Canadian astronomers to have access to a large world-class telescope.,Sa création est motivée par les besoins croissants des astronomes canadiens d'avoir accès à un grand télescope d'envergure internationale.
235,"The observatory immediately achieved international status by housing a 1.83-metre telescope that was the largest operating telescope in the world, although it only held this title for a few months.","Doté dès son inauguration d'un télescope de 1,83 mètre, l'Observatoire Fédéral d'Astrophysique aura en effet, pendant quelques mois, le plus grand télescope au monde."
236,"The installation of the telescope was largely the work of celebrated Canadian astronomer John Stanley Plaskett, and the instrument was baptized the ""Plaskett Telescope"" in his honour.",La conception du télescope est en grande partie l'œuvre du célèbre astronome canadien John Stanley Plaskett ; le télescope de l'observatoire est d'ailleurs baptisé « Télescope de Plaskett » en son honneur.
237,It measured 15 metres long and its mobile parts weighed 42 tonnes.,Il fait 15 mètres de long et ses parties mobiles pèsent 42 tonnes.
238,Plaskett became the first Director of the Dominion Astrophysical Observatory and helped it establish an international research reputation very early on.,Plaskett devient le premier directeur de l'observatoire et contribue dès les débuts à donner une réputation internationale à l'établissement.
239,"In 1922, for example, he discovered a binary star and the larger of the two still holds the record as the most massive known binary star.","En 1922, il découvre en effet une étoile binaire dont l'étoile principale est la plus massive connue jusqu'alors."
240,"This celestial body bears the name of ""Plaskett’s Star"" in his honour.","Aujourd'hui, cette étoile est encore connue sous le nom « d'étoile de Plaskett »."
241,"During subsequent years, Plaskett established the radial velocities of several stars (that is, the speed at which the stars are moving away or toward the observer) and demonstrated that our galaxy, the Milky Way, is rotating.","Pendant les années qui suivent, Plaskett détermine les vitesses radiales (c'est-à-dire les vitesses à lesquelles les étoiles s'approchent ou s'éloignent de nous) de plusieurs étoiles et démontre que notre galaxie, la Voie lactée, tourne."
242,"He was also the first to measure the size, mass and rotational speed of the Milky Way.","Il est également le premier à mesurer la taille, la masse et la vitesse de rotation de la Voie lactée."
243,"He also established that the Sun is located at 2/3 the distance from the centre of our galaxy to its edge, and that our solar system takes approximately 22 million years to complete one galaxial rotation.",Il établit aussi que le Soleil se trouve au 2/3 du centre de la galaxie et que l'astre prend environ 220 millions d'années à en faire le tour.
244,"In 1940, the Dominion Astrophysical Observatory was the site of two other major discoveries.","En 1940, l'Observatoire Fédéral d'Astrophysique est témoin de deux autres découvertes majeures."
245,"Andrew McKellar, one of the observatory’s astronomers, became the first researcher to detect the presence of matter in interstellar space when he identified the spectral bands for the organic compounds cyanogen (""CN"") and methyne (""CH"").","Andrew McKellar, qui est astronome à l'observatoire, devient le premier chercheur à détecter la présence de matière dans l'espace interstellaire avec l'identification des raies du spectre du cyanogène (ou CN) et du méthyne (ou CH)."
246,"One year later, in 1941, he determined the temperature of the cyanogen molecules and deduced that the interstellar environment in which they are found is very cold, approximately -270 °C.","Un an plus tard, en 1941, il détermine la température des molécules de cyanogène et déduit que le milieu interstellaire dans lequel elles se trouvent est très froid, soit environ -270 °C."
247,It was the first direct measurement of the temperature of the Universe.,C'est la première mesure directe de la température de l'Univers.
248,"In 1962, the observatory acquired a second telescope measuring 1.22 metres in diameter.","En 1962, l'observatoire fait l'acquisition d'un second télescope de 1,22 mètre de diamètre."
249,"Equipped with only a spectroscope, it was mainly used to study binary stars.","Équipé uniquement d'un spectroscope, il sert surtout à l'étude d'étoiles binaires."
250,"In 1970, the responsibility of the observatory was conferred to the National Research Council of Canada.","En 1970, la responsabilité de l'observatoire est confiée au Conseil National de Recherches du Canada."
251,"In 1981, the observatory received a third telescope measuring 40 centimetres across.","En 1981, l'observatoire se dote d'un troisième télescope de 40 centimètres."
252,"It was primarily used for scientific research, notably the study of gas clouds in our galaxy (the Milky Way), and to test instruments destined for large telescopes.","Il est d'abord utilisé pour la recherche scientifique, notamment l'étude des nuages de gaz de notre galaxie, la Voie lactée, et pour tester des instruments destinés à des télescopes plus grands."
253,Today it is used to show the sky to the general public.,On l'utilise aujourd'hui pour montrer le ciel au grand public.
254,"In 1995, the observatory became the headquarters for the Herzberg Institute of Astrophysics, which operates several telescopes (optical and radio) in Canada and shares many others with various countries elsewhere in the world, including the Canada-France-Hawaii Telescope and the Gemini telescopes.","En 1995, l'observatoire devient le siège de l'Institut Herzberg d'Astrophysique qui opère plusieurs télescopes (optiques et radio) au Canada et qui en partage de nombreux autres avec différents pays ailleurs dans le monde, tels le télescope Canada-France-Hawaï et les télescopes Gemini."
255,"In 2001, the observatory inaugurated an interpretation centre open to the general public all year long and affectionately named ""The Centre of the Universe"".","En 2001, l'observatoire inaugure son propre centre d'interprétation pour le grand public, « le Centre de l'Univers »."
256,"It includes a small planetarium and offers interactive displays, multimedia presentations and special events designed to introduce people from all walks of life to the world of astronomy.","Ouvert à l'année, il est doté d'un petit planétarium et offre des expositions interactives, des présentations multimédias et des évènements spéciaux destinés à familiariser le grand public avec l'astronomie."
257,"Over the years, new instruments were added and many technical improvements were made to the Plaskett Telescope, the observatory’s main telescope.","Celui-ci est désormais 10 000 fois plus sensible qu'en 1918, année de sa mise en service."
258,"Today, the Dominion Astrophysical Observatory is the responsibility of the National Research Council of Canada’s Herzberg Institute of Astrophysics.",L'observatoire est aujourd'hui sous la responsabilité de l'Institut Herzberg d'Astrophysique du Conseil National de Recherches du Canada.
259,"Astronomers « Return to the observatories The David Dunlap Observatory Home to the largest optical telescope in Canada The David Dunlap Observatory opened its doors in 1935 near the small town of Richmond Hill, 25 kilometres north of Toronto, Ontario.","Astronomes « Retour aux observatoires L'Observatoire David Dunlap L'observatoire abritant le plus grand télescope optique du Canada L'Observatoire David Dunlap ouvre ses portes en 1935 près de la petite ville de Richmond Hill, à 25 kilomètres au nord de Toronto, en Ontario."
260,The facility was the property of the University of Toronto and was operated by the astronomy department.,L'établissement est la propriété de l'Université de Toronto et est opéré par son département d'astronomie.
261,"It was created to conduct astronomical research, to assist in the advanced education of university students, and to stimulate the public’s interest in astronomy.","Sa création a pour but la recherche astronomique, la formation avancée d'étudiants de l'université et la stimulation de l'intérêt du public pour l'astronomie."
262,"The observatory was mainly the work of Clarence Augustus Chant, a Canadian astronomer and astronomy professor at the University of Toronto.","L'observatoire est principalement l'œuvre de l'astronome canadien Clarence Augustus Chant, professeur d'astronomie à l'Université de Toronto."
263,"In 1921, while campaigning to establish a large telescope observatory in the Toronto region, Chant managed to get David Dunlap, a lawyer and mining entrepreneur, interested in the project.","En 1921, soucieux d'établir un observatoire astronomique doté d'un grand télescope dans la région de Toronto, Chant intéresse au projet David Dunlap, un avocat et entrepreneur minier."
264,"Unfortunately, Dunlap died in 1924, but his widow, Jessie, took up the cause and worked for the next ten years with Chant to make sure the project succeeded.","Malheureusement, Dunlap meurt en 1924 mais sa veuve, Jessie, prend la relève et travaille les dix années suivantes de concert avec Chant à concrétiser le tout."
265,"The observatory was inaugurated the same day that Chant celebrated his 70th birthday, received an honorary doctorate from the University of Toronto, and took his retirement.","L'observatoire est inauguré le jour même où Chant célèbre son soixante-dixième anniversaire, reçoit un doctorat honorifique de l'Université de Toronto, et prend sa retraite."
266,"At the time of its inauguration, the observatory housed a 1.88-metre telescope, the second largest in the world after the Mount Wilson telescope in the United States, and Canada thus owned two of the four largest telescopes in the world.","Au moment de son inauguration, l'observatoire abrite un télescope de 1,88 mètre, soit le deuxième plus grand télescope au monde, après celui du Mont Wilson, aux États-Unis."
267,The building that houses the administrative offices of the observatory was also inaugurated in 1935.,Le Canada possède alors deux des quatre plus grands télescopes au monde.
268,"Over the years, more and more radio astronomers were joining the astronomy department at the University of Toronto, and in the 1960’s, the David Dunlap Observatory actively participated in the development of the Algonquin Radio Observatory in Ontario.","Au fil des années, de plus en plus de radioastronomes se joignent au département d'astronomie de l'Université de Toronto et dans les années 1960, l'Observatoire David Dunlap participe activement au développement de l'Observatoire Algonquin de Radioastronomie, en Ontario."
269,"By the end of the 1960’s, the David Dunlap Observatory, being located near the major urban centre of Toronto, found itself plagued with the problem of light pollution.","À la fin des années 1960, l'observatoire David Dunlap, situé près de Toronto, se trouve aux prises avec un problème croissant de pollution lumineuse."
270,The observatory responded in 1971 by erecting a 60-centimetre telescope at Las Campanas in Chile.,"Pour contrer en partie le problème, un télescope de 60 centimètres est érigé en 1971 à Las Campanas, au Chili."
271,The David Dunlap Observatory thus acquired international status and the skies of the south were available to Canadian astronomers for the first time.,L'Observatoire David Dunlap devient ainsi international et l'hémisphère Sud s'ouvre pour la première fois à des astronomes canadiens.
272,A spectacular discovery was made at the David Dunlap Observatory in 1972.,"En 1972, l'Observatoire David Dunlap est l'hôte d'une découverte spectaculaire."
273,"Charles Thomas Bolton, one of the observatory’s astronomers, discovered Cygnus X-1, the first black hole ever identified.","Charles Thomas Bolton, qui est astronome à l'observatoire, découvre le premier trou noir jamais identifié, Cygnus X-1."
274,"In 1987, the observatory was responsible for another amazing discovery thanks to its telescope in Las Campanas.","En 1987, l'observatoire est responsable d'une autre découverte spectaculaire grâce à son télescope de Las Campanas."
275,"Ian Shelton, one of the astronomers from the University of Toronto, was using the Chilean telescope when he observed a supernova (1987 A) in the Greater Magellan could.","Ian Shelton, alors astronome à l'Université de Toronto, observe en effet depuis le Chili dans le grand Nuage de Magellan la première supernova (1987A) visible à l'œil nu en près de 400 ans."
276,"The discovery made headlines around the world, as it was the first supernova visible to the unaided eye in almost 400 years.",La découverte fait les manchettes des journaux du monde entier.
277,"Unfortunately, financial problems forced the David Dunlap Observatory to cease operations at Las Campanas in 1997.","En 1997, suite à des impératifs financiers, l'Observatoire David Dunlap doit malheureusement cesser les opérations de son télescope de Las Campanas, au Chili."
278,The National Observatory of Argentina took charge of the telescope and moved it from Chile to Parque El Leoncito in Argentina.,"Le télescope est alors pris en charge par l'Observatoire National de l'Argentine et déménagé au site de Parque El Leoncito, en Argentine."
279,The David Dunlap Observatory nonetheless retains one quarter of the observation time at the telescope.,L'Observatoire David Dunlap conserve toutefois le quart du temps d'observation du télescope.
280,"Today, the David Dunlap Observatory of Toronto is still active thanks in part to a light pollution abatement program initiated by Charles Thomas Bolton.","À l'heure actuelle, l'Observatoire David Dunlap de Toronto est toujours actif grâce, entre autres, à un programme de prévention de la pollution lumineuse instauré par Charles Thomas Bolton."
281,Astronomers « Return to the observatories The Algonquin Radio Observatory Home to the largest parabolic antenna in Canada The Algonquin Radio Observatory was inaugurated in 1959 at Traverse Lake in the Algonquin National Park in Ontario.,"Astronomes « Retour aux observatoires L'Observatoire Algonquin de Radioastronomie L'observatoire où l'on trouve la plus grande antenne parabolique du Canada L'Observatoire Algonquin de Radioastronomie est inauguré en 1959 sur le site du Lac Traverse, dans le Parc National Algonquin, en Ontario."
282,It was created by the National Research Council of Canada for Canadian radio astronomers who needed a site in Ontario where radio interference would be minimal.,"Sa création par le Conseil National de Recherches du Canada est motivée par le besoin des radioastronomes canadiens d'occuper, en Ontario, un site où les interférences radio sont minimes."
283,"The first director was Arthur Edwin Covington, Canada’s first radio astronomer.","Le premier directeur à prendre en charge le site est Arthur Edwin Covington, le premier radioastronome canadien."
284,"More than a decade earlier, in 1946, Covington had collected data on the Sun’s radio flux (the variations in its energy output at radio wavelengths) from a site in Ottawa, and again in 1947 from Goth Hill south of Ottawa.","Une dizaine d'années plus tôt, en 1946, Covington collecte des données sur le flux de radiations en provenance du Soleil depuis Ottawa et, en 1947, depuis le site de Goth Hill, situé au sud d'Ottawa."
285,"His work became of paramount importance when he demonstrated that the intensity of solar radiation was related to the Sun’s magnetic activity, which had (and still has) crucial implications for numerous human activities, such as communications systems and power lines.","Ses travaux prennent une importance capitale lorsqu'il démontre que l'intensité des radiations solaires est reliée à l'activité magnétique du Soleil, ce qui a des implications cruciales pour de nombreuses activités humaines comme les communications et les lignes de transport d'énergie."
286,The Traverse Lake site in Algonquin National Park was selected for the Algonquin Radio Observatory due to its relative isolation from manmade interference.,"Le site du Lac Traverse, dans le Parc National Algonquin, est alors choisi pour l'Observatoire Algonquin de Radioastronomie parce qu'il est isolé des interférences radio d'origine humaine."
287,Covington installed a parabolic mirror with a diameter of 1.83 metres in 1960 and began moving his equipment from Goth Hill in 1962.,"Covington y installe, en 1960, une antenne parabolique de 1,83 mètre de diamètre et y déménage, dès 1962, ses équipements de Goth Hill."
288,"The radio telescopes operated continuously at a wavelength of 10.7 centimetres, which is an ideal wavelength for monitoring solar activity due to the Sun’s particular chemical composition.","Les radiotélescopes opèrent tous en continu à une longueur d'onde de 10,7 centimètres, une longueur d'onde idéale pour surveiller l'activité du Soleil en raison de sa composition chimique."
289,"In 1966, an array consisting of 32 parabolic antennas, each 3 metres in diameter, was added to the observatory.","En 1966, un réseau de 32 antennes paraboliques de 3 mètres de diamètre est ajouté à l'observatoire."
290,The goal was to refine the measurements from other radio telescopes by scanning the Sun’s surface every noon at a wavelength of 10.7 centimetres.,"Ces antennes ont pour but d'affiner les mesures faites par les autres radiotélescopes en balayant la surface du Soleil à tous les midis à une longueur d'onde de 10,7 centimètres."
291,"Operating at a wavelength of 2 centimetres, it was used to study galactic and extragalactic objects that emit radio waves, such as quasars.","Opérant à une longueur d'onde de 2 centimètres, elle est utilisée pour l'étude d'objets galactiques et extragalactiques qui émettent des ondes radio comme les quasars."
292,"In 1968, the 46-metre radio telescope was used in conjunction with the 26-metre instrument at the Dominion Radio Astrophysical Observatory of Penticton, British Columbia, to simulate the resolution of a giant 3,074-kilometre radio telescope (the physical distance separating the two instruments).","En 1968, le radiotélescope de 46 mètres est utilisé conjointement avec celui de 26 mètres de l'Observatoire Fédéral de Radioastrophysique de Penticton, en Colombie-Britanique, pour simuler un radiotélescope géant de 3074 kilomètres (soit la distance séparant les deux observatoires)."
293,It was the first successful long distance interferometry experiment ever conducted.,Il s'agit de la première expérience réussie d'interférométrie à très grande séparation jamais réalisée.
294,The goal of the experiment was to discern a source of radio waves with great precision.,Le but d'une telle expérience est de discerner avec précision un objet qui émet des ondes radio.
295,"Very large antennas are necessary to precisely determine the position of radio sources because radio waves have much larger wavelengths than visible light waves, and because the detection of any object in space depends largely on the size of the observation instrument (that is, its lenses, mirrors or radio antennas).","Comme la détection d'un objet dans l'espace dépend largement de la taille de l'instrument d'observation (tels que lentilles, miroir ou antenne radio) et comme les ondes radio ont des longueurs d'onde largement plus grandes que les ondes de la lumière visible, de très grandes antennes sont donc nécessaires pour discerner avec précision les objets émetteurs d'ondes radio."
296,The 1970’s marked a time of increased collaboration between the Algonquin Observatory radio astronomers and the researchers at the Herzberg Institute of Astrophysics.,Les années 1970 voient les radioastronomes de l'Observatoire Algonquin collaborer de plus en plus avec les chercheurs de l'Institut Herzberg d'Astrophysique.
297,Many new complex chemical compounds were identified for the first time in interstellar gas clouds thanks to the collaborative effort.,Plusieurs nouveaux composés chimiques complexes sont alors identifiés pour la première fois dans les nuages de gaz interstellaires.
298,"After planning to resurface the 46-metre radio telescope so that it could operate at wavelengths as small as 3 millimetres, the National Research Council of Canada decided instead to close the Algonquin Observatory in 1987 and purchase a 25% share in the new James-Clerk-Maxwell Observatory, which would include a radio telescope that could operate at 0.3 to 2 millimetres.","Après avoir envisagé de refaire la surface du radiotélescope de 46 mètres de façon à pouvoir opérer à des longueurs d'onde aussi petites que 3 millimètres, le Conseil National de Recherches du Canada décide en 1987 de fermer l'Observatoire Algonquin et d'acheter une contribution de 25 % dans le nouvel Observatoire James-Clerk-Maxwell dont le radiotélescope opère de 0,3 à 2 millimètres."
299,"In 1990, the work of collecting data on the Sun’s radio flux moved to the Dominion Radio Astrophysical Observatory in Penticton, British Columbia.","En 1990, les activités reliées à la collecte de données sur le flux de radiations solaires déménagent à L'Observatoire Fédéral de Radioastrophysique de Penticton, en Colombie-Britanique et en 1991, l'Observatoire Algonquin de Radioastronomie ferme."
300,"In 1991, the Algonquin Radio Observatory was finally closed, but the 46-metre antenna is nonetheless still active as part of a continental network of antennas that precisely measures movements of the North American tectonic plate.",L'antenne de 46 mètres est cependant toujours active comme élément d'un réseau continental d'antennes servant à mesurer avec précision les mouvements de la plaque tectonique nord-américaine.
301,"Astronomers « Return to the observatories The Dominion Radio Astrophysical Observatory The largest radio astronomy observatory in Canada The Dominion Radio Astrophysical Observatory was inaugurated in 1960 at White Lake near Penticton, British Columbia.","Astronomes « Retour aux observatoires L'Observatoire Fédéral de Radioastrophysique Le plus important observatoire de radioastronomie du Canada L'Observatoire Fédéral de Radioastrophysique est inauguré en 1960 à White Lake, près de Penticton, en Colombie-Britanique."
302,"The creation of the observatory was primarily the work of Carlyle Smith Beals, an astronomer who wanted to advance the field of astrophysics in Canada.",La création de l'observatoire est le résultat des efforts de l'astronome Carlyle Smith Beals qui souhaite développer davantage l'astrophysique au Canada.
303,"The first parabolic antenna, measuring 25.6 metres, began operating in 1960.","Une première antenne parabolique de 25,6 mètres commence à opérer en 1960."
304,"It was mainly designed to operate at a wavelength of 21 centimetres, which corresponds to one of the spectral lines of hydrogen.","Elle est principalement conçue pour fonctionner à une longueur d'onde de 21 centimètres, ce qui correspond à une raie spectrale de l'hydrogène."
305,Radio astronomers at Penticton have been striving towards this goal since the first days of the observatory.,Les radioastronomes de Penticton s'attèleront d'ailleurs à cette tâche dès les débuts de l'observatoire.
306,"In 1962, a second radio telescope was put in place.","En 1962, un second radiotélescope est mis en chantier."
307,"Fully operational in 1964, it consisted of 1,700 cedar posts that extended for 1.3 kilometres in the shape of a ""T"" to cover a surface area of 65,000 square metres.","Pleinement opérationnel en 1964, il est constitué de près de 1700 poteaux de cèdre s'étendant sur 1,3 kilomètre en forme de « T » et formant une surface de 65 000 mètres carrés."
308,The posts supported a network of several thousand metres of metallic wires formed the antenna of the radio telescope.,"La taille gigantesque de l'antenne permet d'opérer à une très grande longueur d'onde, soit 13,5 mètres, une chose jamais tentée."
309,This radio telescope was primarily used between 1965 and 1969 during a period when solar spots were at a minimum.,"Ce radiotélescope est utilisé principalement entre 1965 et 1969, lors d'une période où les taches solaires sont à leur minimum."
310,"In fact, it is only during these periods of low solar activity that very long radio waves from space can pass through the atmosphere to reach Earth’s surface.","Ce n'est, en effet, que pendant de telles périodes que les ondes radio de très grande longueur d'onde en provenance de l'espace peuvent traverser l'atmosphère et atteindre la surface terrestre."
311,The main goal of the T-shaped radio telescope at Penticton was to produce a map of radio sources in our galaxy.,Le but principal du radiotélescope en « T » est de produire une carte des sources radio de notre galaxie qui sont visibles depuis le site de Penticton.
